{
  "application": {
    "id": "urn:example:applications:catalog",
    "title": "Catalog"
  },
  "bundle_id": "urn:example:bundles:catalog",
  "contracts": [],
  "evidence": [],
  "files": [
    {
      "media_type": "text/markdown",
      "owner": "example-publication",
      "ownership": "generated",
      "path": "index.md",
      "role": "index",
      "sha256": "81d32f593fc2168bc91bc68082fcd8aceb5932704777ce47a9c51ce5698301c7"
    },
    {
      "media_type": "application/json",
      "owner": "example-publication",
      "ownership": "generated",
      "path": "publication.json",
      "role": "provenance",
      "sha256": "e0fe0234a44f3729728f8a567549c36b8b238e70bfd7d6e1cf0a7b1698d4d070"
    },
    {
      "media_type": "text/markdown",
      "owner": "example-publication",
      "ownership": "generated",
      "path": "system.md",
      "role": "concept",
      "sha256": "9d08ec579cdf71e7e80681a398ad763d3aa89b08db20c9f3359745e35e788f40"
    }
  ],
  "inventory_scope": "declared",
  "measurements": [],
  "migrations": [],
  "okf_version": "0.2",
  "profile": {
    "id": "application-knowledge",
    "version": "1.0.0-draft.1"
  },
  "publication": "publication.json",
  "removed_subjects": [],
  "required_capabilities": [],
  "subjects": [
    {
      "id": "application",
      "key": "catalog",
      "kind": "application",
      "page": "system.md",
      "status": "active",
      "title": "Catalog"
    }
  ]
}
