{
  "application": {
    "id": "urn:example:applications:payments",
    "title": "Payments"
  },
  "bundle_id": "urn:example:bundles:payments",
  "contracts": [
    {
      "format": "openapi",
      "id": "contract:payments-v1",
      "key": "payments-v1",
      "manifest": "contracts/payments-v1/manifest.json",
      "origin": "supplied",
      "subject_ids": [
        "api:payments"
      ]
    }
  ],
  "evidence": [
    {
      "group": "default",
      "path": "evidence/tests/create-payment/primary/attempt.json",
      "slot": "primary",
      "test_id": "test:create-payment"
    }
  ],
  "files": [
    {
      "media_type": "text/markdown",
      "owner": "example-publication",
      "ownership": "generated",
      "path": "apis/payments/api.md",
      "role": "concept",
      "sha256": "0f7865ad7f4947595f602a5f42c0222ab937291696cfe07e3e23bc44131c6ee2"
    },
    {
      "media_type": "text/markdown",
      "owner": "example-publication",
      "ownership": "generated",
      "path": "apis/payments/operations/create-payment.md",
      "role": "concept",
      "sha256": "ce6696d1f7e8231518a741b530e8d66e5eae43410fe0ec5c88634df42268fc83"
    },
    {
      "media_type": "application/json",
      "owner": "example-publication",
      "ownership": "generated",
      "path": "contracts/payments-v1/manifest.json",
      "role": "contract",
      "sha256": "e70769c14cd3ae264db4d2e025d28db24ac04eaf4d7058b67a765d6d63b5a6f7"
    },
    {
      "media_type": "application/json",
      "owner": "example-publication",
      "ownership": "generated",
      "path": "contracts/payments-v1/openapi.json",
      "role": "contract",
      "sha256": "f3656dee9897c0351d2f7b49aae928cfa8de97a90da36af2b1ba7705f894d009"
    },
    {
      "media_type": "application/json",
      "owner": "example-publication",
      "ownership": "generated",
      "path": "contracts/payments-v1/schemas/payment.json",
      "role": "contract",
      "sha256": "35ac7b6eaf89bf107a01dd7118be9f851d014c6e1cbd0b786d0c9e24b91c9b1c"
    },
    {
      "media_type": "application/json",
      "owner": "example-publication",
      "ownership": "generated",
      "path": "evidence/tests/create-payment/primary/attempt.json",
      "role": "evidence",
      "sha256": "eb133815292777e70f58b0d7f0f93df883b4d27a1bf4c263a57407aebfbd4a4c"
    },
    {
      "media_type": "application/json",
      "owner": "example-publication",
      "ownership": "generated",
      "path": "evidence/tests/create-payment/primary/response.json",
      "role": "evidence",
      "sha256": "691a307fd02a374a9111ab3e01c37c983ca8f2e23efaf3c0ec312170a7d70892"
    },
    {
      "media_type": "text/markdown",
      "owner": "example-publication",
      "ownership": "generated",
      "path": "index.md",
      "role": "index",
      "sha256": "ec20542e7fc7b199c3b4b2f85ed9cddc16c54e9ebb7168183710953c7db6988a"
    },
    {
      "media_type": "application/json",
      "owner": "example-publication",
      "ownership": "generated",
      "path": "publication.json",
      "role": "provenance",
      "sha256": "4db2e97fda047a2cd44568a850f934b665ef156347065ff2e6f8268f4f1b6923"
    },
    {
      "media_type": "text/markdown",
      "owner": "example-publication",
      "ownership": "generated",
      "path": "system.md",
      "role": "concept",
      "sha256": "0ad7da1cb725d1869c6a4e58711eaccd191639c7874c283333c012f6b4733bd1"
    },
    {
      "media_type": "text/markdown",
      "owner": "example-publication",
      "ownership": "generated",
      "path": "tests/create-payment/test.md",
      "role": "concept",
      "sha256": "a221623d9e2383d61f7566ba6919f3c412a020a43a2f0d7b15e65708cbcf3c5f"
    }
  ],
  "inventory_scope": "declared-and-observed",
  "measurements": [],
  "migrations": [],
  "okf_version": "0.2",
  "profile": {
    "id": "application-knowledge",
    "version": "1.0.0-draft.1"
  },
  "publication": "publication.json",
  "removed_subjects": [],
  "required_capabilities": [
    "test-result.v1"
  ],
  "subjects": [
    {
      "contract_ids": [
        "contract:payments-v1"
      ],
      "id": "api:payments",
      "key": "payments",
      "kind": "provided-api",
      "page": "apis/payments/api.md",
      "parent_id": "application",
      "resource": "urn:example:apis:payments",
      "status": "active",
      "title": "Payments API"
    },
    {
      "id": "application",
      "key": "payments",
      "kind": "application",
      "page": "system.md",
      "status": "active",
      "title": "Payments"
    },
    {
      "contract_ids": [
        "contract:payments-v1"
      ],
      "id": "operation:payments:create-payment",
      "key": "create-payment",
      "kind": "operation",
      "operation": "POST /payments",
      "page": "apis/payments/operations/create-payment.md",
      "parent_id": "api:payments",
      "protocol": "http",
      "status": "active",
      "title": "Create payment"
    },
    {
      "id": "test:create-payment",
      "key": "create-payment",
      "kind": "test",
      "page": "tests/create-payment/test.md",
      "parent_id": "application",
      "source": {
        "path": "tests/payments.test.js",
        "source_id": "test-source",
        "symbol": "creates a payment"
      },
      "status": "active",
      "title": "Create payment"
    }
  ]
}
