{
  "application": {
    "id": "urn:test:shop",
    "title": "Shop"
  },
  "bundle_id": "urn:test:shop:knowledge",
  "contracts": [
    {
      "format": "openapi",
      "id": "contract:shop-v1",
      "key": "shop-v1",
      "manifest": "contracts/shop-v1/manifest.json",
      "origin": "supplied",
      "subject_ids": [
        "api:shop",
        "op:shop:checkout"
      ]
    }
  ],
  "evidence": [
    {
      "group": "default",
      "path": "evidence/tests/checkout/primary/attempt.json",
      "slot": "primary",
      "test_id": "test:checkout"
    }
  ],
  "files": [
    {
      "media_type": "text/markdown",
      "owner": "dev.phrond.wiretap",
      "ownership": "generated",
      "path": "apis/shop/api.md",
      "role": "concept",
      "sha256": "ef53514c129f377af1a49806665a22b38fc5b1bf48ca8ef9067885dd6d7bd9f1"
    },
    {
      "media_type": "text/markdown",
      "owner": "dev.phrond.wiretap",
      "ownership": "generated",
      "path": "apis/shop/operations/checkout.md",
      "role": "concept",
      "sha256": "074f4978032890465e4f2151cab0a6f52e37ed6fa435fecbb09de770a9b63e9a"
    },
    {
      "media_type": "application/json",
      "owner": "dev.phrond.wiretap",
      "ownership": "generated",
      "path": "contracts/shop-v1/manifest.json",
      "role": "contract",
      "sha256": "c428bf8b2723bc3f772951752d1aa1ddbe0a988b0ffa6f46e6672e10f9b47503"
    },
    {
      "media_type": "application/json",
      "owner": "dev.phrond.wiretap",
      "ownership": "generated",
      "path": "contracts/shop-v1/openapi.json",
      "role": "contract",
      "sha256": "5c673125ffd86e3dc4e4168ad2d86b8166fad89ae6af57cc49fd61ca635a826b"
    },
    {
      "media_type": "application/json",
      "owner": "dev.phrond.wiretap",
      "ownership": "generated",
      "path": "evidence/tests/checkout/primary/attempt.json",
      "role": "evidence",
      "sha256": "2d58791e28582952685e542979ce45e57ed52ee228e5c50e3b667b946aa7cd74"
    },
    {
      "media_type": "application/json",
      "owner": "dev.phrond.wiretap",
      "ownership": "generated",
      "path": "evidence/tests/checkout/primary/recording.json",
      "role": "evidence",
      "sha256": "ca71aa29d2cd3267fd77010fc2364e214ab7b40da251a50adf5b94e42f9209dd"
    },
    {
      "media_type": "text/markdown",
      "owner": "dev.phrond.wiretap",
      "ownership": "generated",
      "path": "index.md",
      "role": "index",
      "sha256": "2401566b731bea374ec17812f2a7af66235a79688b136cedc622d7ecc4f2a41c"
    },
    {
      "media_type": "application/json",
      "owner": "dev.phrond.wiretap",
      "ownership": "generated",
      "path": "publication.json",
      "role": "provenance",
      "sha256": "6960417a17e147b54adfc3b2c9c60dd0a629429a7cea0e3c09679c83f1854fe3"
    },
    {
      "media_type": "text/markdown",
      "owner": "dev.phrond.wiretap",
      "ownership": "generated",
      "path": "system.md",
      "role": "concept",
      "sha256": "39fb09067c8575d2fe3ec844303ab90a127e7c890f7517aa3b7b0efa003e8edc"
    },
    {
      "media_type": "text/markdown",
      "owner": "dev.phrond.wiretap",
      "ownership": "generated",
      "path": "tests/checkout/test.md",
      "role": "concept",
      "sha256": "8480d1991e9ca472a7a05aa70e594be7687721dafb912f2cf2bea3fd86d6d7f5"
    }
  ],
  "inventory_scope": "declared-and-observed",
  "measurements": [],
  "migrations": [],
  "okf_version": "0.2",
  "profile": {
    "id": "application-knowledge",
    "version": "1.0.0-draft.1"
  },
  "publication": "publication.json",
  "removed_subjects": [],
  "required_capabilities": [
    "test-result.v1"
  ],
  "subjects": [
    {
      "contract_ids": [
        "contract:shop-v1"
      ],
      "id": "api:shop",
      "key": "shop",
      "kind": "provided-api",
      "page": "apis/shop/api.md",
      "parent_id": "application",
      "status": "active",
      "title": "Shop API"
    },
    {
      "id": "application",
      "key": "shop",
      "kind": "application",
      "page": "system.md",
      "status": "active",
      "title": "Shop"
    },
    {
      "contract_ids": [
        "contract:shop-v1"
      ],
      "id": "op:shop:checkout",
      "key": "checkout",
      "kind": "operation",
      "operation": "POST /checkout",
      "page": "apis/shop/operations/checkout.md",
      "parent_id": "api:shop",
      "protocol": "http",
      "status": "active",
      "title": "Checkout"
    },
    {
      "id": "test:checkout",
      "key": "checkout",
      "kind": "test",
      "page": "tests/checkout/test.md",
      "parent_id": "application",
      "status": "active",
      "title": "checkout"
    }
  ]
}
